course_title,is_paid,price,num_subscribers,num_reviews,num_lectures,level,content_duration,published_timestamp,subject
Javascript Intermediate level 3 - JSON,True,100,1735,76,25,All Levels,2.5,2016-08-30,Web Development
Develop Your First App in an Hour,True,20,3699,201,11,Beginner Level,1.0,2016-05-17,Web Development
PHP: Ultimate guide to PHP for everyone,True,115,10103,75,20,Beginner Level,1.5,2016-05-29,Web Development
JavaScript DOM Dynamic Web interactive content Boot Camp,True,75,7380,43,59,All Levels,2.5,2015-07-30,Web Development
"Master JavaScript Programming, 3 Projects Included !!",True,20,3903,53,107,All Levels,10.5,2017-06-27,Web Development
HTML CSS Learn to create a website from scratch,True,50,4892,49,32,Beginner Level,2.0,2016-08-04,Web Development
Complete Codeigniter: From Beginner to Advanced,True,200,2786,31,20,All Levels,3.0,2017-01-24,Web Development
HTML 5: How I made websites in HTML5,True,135,15064,237,15,All Levels,1.5,2014-10-23,Web Development
"Build Responsive Website Using HTML5, CSS3, JS And Bootstrap",True,95,22623,783,73,All Levels,8.0,2016-06-20,Web Development
Complete React JS web developer with ES6 - Build 10 projects,True,200,952,121,75,Beginner Level,12.0,2017-03-22,Web Development
Complete WordPress Theme Developer Course With Bootstrap,True,150,3415,312,160,All Levels,25.0,2016-07-01,Web Development
The Complete Ethical Hacking Course 2.0: Python & Kali Linux,True,195,7827,268,66,All Levels,11.0,2016-09-26,Web Development
Dynamic JavaScript Master Class AJAX JSON Simple APIs,True,200,9773,117,65,Intermediate Level,4.5,2016-10-24,Web Development
Vue JS - Mastering Web Apps,True,80,13457,215,69,All Levels,4.5,2017-04-06,Web Development
Angular NgRx Store Masterclass - Covers Angular 4,True,150,1399,212,89,Intermediate Level,8.5,2017-01-19,Web Development
JavaScript the Basics - JavaScript for Beginners,True,120,4028,674,93,Beginner Level,9.0,2016-06-09,Web Development
"Complete E-Commerce Course - Java,Spring,Hibernate and MySQL",True,195,1371,165,83,All Levels,20.0,2017-01-16,Web Development
"Learn SVG Animation - With HTML, CSS & Javascript",True,65,12953,680,22,All Levels,1.5,2016-09-12,Web Development
"Build a Responsive Website with HTML5, CSS3 and Bootstrap 4",True,20,5125,395,53,All Levels,7.0,2016-08-09,Web Development
Learn Web Designing & HTML5/CSS3 Essentials in 4-Hours,True,75,43285,525,24,All Levels,4.0,2013-01-03,Web Development
CSS Development (with CSS3!),True,20,25864,188,32,All Levels,5.0,2012-10-31,Web Development
Angular 2 & TypeScript Beginner Web Development,True,200,5211,414,133,Beginner Level,19.5,2016-11-14,Web Development
The Docker for DevOps course: From development to production,True,25,8234,1111,110,All Levels,7.5,2015-11-13,Web Development
"Beginner Full Stack Web Development: HTML, CSS, React & Node",True,200,2687,331,138,Beginner Level,25.5,2017-03-31,Web Development
Learn Angular 2 Development By Building 12 Apps,True,50,5143,941,80,Intermediate Level,12.0,2016-07-01,Web Development
"Server API Development in Swift, Kitura, & Bluemix",True,200,1827,129,66,Beginner Level,20.5,2017-03-08,Web Development
React VR - Creating Virtual Reality Apps,True,80,5026,72,43,All Levels,3.0,2017-05-17,Web Development
RxJs & Reactive Programming Angular Masterclass - Angular 4,True,150,1301,179,80,All Levels,7.5,2017-04-11,Web Development
"Coding for Entrepreneurs: Learn Python, Django, and More.",True,195,23412,799,251,All Levels,45.0,2013-04-08,Web Development
React and Flux Web Development for Beginners,True,100,8691,836,63,Beginner Level,11.0,2015-12-15,Web Development
The Full Stack Web Development,True,60,3119,453,207,Beginner Level,33.0,2016-11-24,Web Development
Learn Nodejs by building 12 projects,True,50,10150,997,90,All Levels,16.0,2015-04-22,Web Development
How to Make an Online Portfolio Website from Scratch ,False,0,14026,232,25,All Levels,1.0,2015-10-02,Web Development
How To Make A Web Page With No Code,False,0,2214,20,23,Beginner Level,2.0,2017-03-23,Web Development
Spring Framework 4 And Dependency Injection For Beginners,False,0,21147,1220,16,Beginner Level,1.5,2015-01-16,Web Development
Joomla 3 - The Basics,False,0,19909,411,17,Beginner Level,3.0,2014-02-12,Web Development
jQuery in Action: Build 8 jQuery Projects,True,100,1385,89,97,All Levels,11.0,2015-09-12,Web Development
Master WordPress Plugins: Shortcodes Ultimate - The Basics,False,0,10780,110,19,All Levels,1.0,2016-01-14,Web Development
ASP.NET C# - Enterprise Web Systems From Novice to Expert,True,20,604,8,43,All Levels,3.5,2017-04-11,Web Development
Wordpress - Create an Outstanding Website in 2 hours,True,30,1772,13,48,Beginner Level,2.5,2015-10-28,Web Development
Complete Website & CMS in PHP & MySQL From Scratch!,True,20,3357,82,48,All Levels,12.5,2014-04-18,Web Development
The Complete Web Development Tutorial Using React and Redux,True,40,796,43,29,Intermediate Level,4.0,2016-07-25,Web Development
Create and Deploy a Web App in 3 Hours,True,50,4123,23,34,Beginner Level,3.5,2013-12-04,Web Development
HTML & CSS From Scratch in 30 Days,True,75,2697,64,82,Beginner Level,11.5,2013-04-22,Web Development
Getting Started with Craft CMS,True,20,997,31,20,All Levels,2.0,2016-11-07,Web Development
JavaScript For Absolute Beginners - Level One,True,65,713,80,8,All Levels,1.5,2016-09-19,Web Development
Effective Personal Website Building and Hosting,True,20,4259,0,11,All Levels,1.0,2016-04-11,Web Development
Web Design for Web Developers: Build Beautiful Websites!,False,0,98867,6512,20,All Levels,3.0,2015-04-13,Web Development
"Learn Rails: Quickly Code, Style and Launch 4 Web Apps",True,200,1849,21,83,All Levels,3.0,2016-08-23,Web Development
Getting Started with NodeJS for Beginners,True,195,1645,75,12,All Levels,1.0,2016-05-23,Web Development
Quickstart AngularJS,False,0,64128,4047,17,Beginner Level,1.5,2014-11-22,Web Development
Byte-Sized-Chunks: Cascading Style Sheets (CSS) with HTML,True,20,2160,16,28,All Levels,4.0,2016-03-10,Web Development
Learn Building Your Own Website Without Coding,True,50,7660,7,19,All Levels,2.0,2014-03-21,Web Development
Practical Guide to Web Development,True,20,2025,16,38,Beginner Level,2.0,2016-05-02,Web Development
The Complete HTML5 and CSS3 Course,True,40,1548,30,126,All Levels,15.0,2016-08-23,Web Development
HTML & CSS for beginners: Build 3 projects from scratch,True,40,2472,139,31,Beginner Level,4.0,2015-01-22,Web Development
Code a 'Coming Soon' Landing Page in Bootstrap 4,False,0,13535,473,18,All Levels,1.5,2016-08-17,Web Development
Introduction to Bootstrap 3,True,20,5795,79,29,Beginner Level,2.5,2013-09-27,Web Development
Master ExpressJS to Build Web Apps with NodeJS&JavaScript,True,50,2643,56,24,All Levels,3.5,2016-01-07,Web Development
Learn XML Crash Course: Discover Essential XML Fundamentals ,True,50,3704,111,18,Intermediate Level,2.0,2014-06-16,Web Development
HTML5 CSS3 JQUERY Single Page Website Project from Scratch,True,120,1678,34,32,All Levels,2.5,2016-02-03,Web Development
Scrape Websites using PhantomJS and CasperJS,True,195,960,110,32,Intermediate Level,2.0,2016-02-26,Web Development
Amazon s3 Mastery - THE How-To' Guides For Amazon S3,True,95,1811,118,36,All Levels,3.5,2015-03-18,Web Development
HTML and CSS Crash Course for Beginners,True,50,4123,46,31,Beginner Level,4.5,2014-05-30,Web Development
EMMET Faster HTML & CSS workflow - Best Tool For Developers ,False,0,26697,1097,20,All Levels,1.0,2015-04-09,Web Development
Introduction to Web Development,True,50,5921,35,42,Beginner Level,4.5,2014-03-11,Web Development
AngularJS For ASP.NET MVC Developers,True,50,3011,57,10,Intermediate Level,1.0,2015-02-23,Web Development
Serverless Workflow Management with AWS Step Functions,False,0,8768,173,8,Intermediate Level,1.0,2016-12-09,Web Development
How to set up a Web Server From Scratch to One Fully Managed,True,200,1673,31,24,All Levels,3.0,2017-05-09,Web Development
The Complete PHP MySQL Professional Course with 5 Projects,True,200,16158,159,125,All Levels,19.5,2017-06-07,Web Development
Angular Masterclass,True,150,4057,359,99,All Levels,6.5,2016-05-09,Web Development
Become a Professional Web Developer | Version 3.0,True,200,6851,276,454,All Levels,60.0,2014-01-21,Web Development
Build Incredible Chatbots,True,100,2234,253,115,All Levels,11.5,2016-11-02,Web Development
Try Django 1.10 | Create a URL Shortening Service,True,50,9607,78,40,All Levels,5.5,2016-10-24,Web Development
Projects in CSS,True,60,4689,216,54,All Levels,10.0,2014-09-23,Web Development
Ruby on Rails: Training and Skills to Build Web Applications,True,95,9375,219,43,All Levels,7.0,2014-01-10,Web Development
Learn and Understand React,True,30,4848,105,123,All Levels,16.5,2017-03-23,Web Development
Learn Javascript & JQuery From Scratch,True,30,84897,2685,10,All Levels,2.0,2013-10-10,Web Development
Learn to use JSON,True,150,12838,96,22,Beginner Level,1.5,2016-03-11,Web Development
The Ultimate Web Developer How To Guide,True,200,24861,423,281,All Levels,22.5,2015-11-26,Web Development
"Build A Complete CRUD Application With PHP, MYSQL & JQUERY",True,20,9762,94,112,All Levels,13.5,2016-11-01,Web Development
jQuery Crash Course: Learn the Essentials of jQuery Fast,True,50,11262,142,18,All Levels,2.0,2015-01-07,Web Development
Drupal Tutorial : Drupal 8 Beginner to Expert in 8 PROJECTS,True,200,1270,16,73,Beginner Level,7.0,2017-05-01,Web Development
The Complete PHP CodeIgniter Course: Beginner To Advanced,True,195,17895,212,30,All Levels,4.0,2015-12-29,Web Development
JavaScript For Beginners : Learn JavaScript From Scratch,True,195,11285,102,77,All Levels,5.5,2017-02-07,Web Development
"Mastering 'Native CSS Shapes To Build Modern Web Pages""",True,195,1040,5,30,All Levels,3.5,2017-05-29,Web Development
WordPress Development For Beginners,True,95,23572,210,20,All Levels,2.0,2016-06-20,Web Development
WordPress local server setup and site migration online,True,55,3801,43,12,All Levels,1.0,2017-01-03,Web Development
PHP Fundamentals - Start Earning The Top Dollars You Deserve,True,195,12068,81,12,All Levels,1.5,2016-04-05,Web Development
Interactive Dynamic JavaScript for beginners DOM,True,200,5559,35,21,Beginner Level,2.0,2017-04-18,Web Development
Javascript Intermediate level 1 - Mastering the DOM,True,100,1838,169,31,All Levels,3.0,2016-08-30,Web Development
Sublime Text for Rapid Web Development,True,20,2104,69,14,All Levels,1.0,2017-01-19,Web Development
Servlets and JSPs Tutorial: Learn Web Applications With Java,True,35,15187,970,64,All Levels,10.0,2012-09-10,Web Development
Projects in PHP and MySQL,True,60,10606,570,88,All Levels,23.0,2014-07-25,Web Development
PHP OOP: Object Oriented Programming for beginners + Project,True,200,6497,901,221,All Levels,18.0,2015-06-03,Web Development
React Redux React-Router: From Beginner to Paid Professional,True,20,11536,876,60,All Levels,6.5,2016-08-25,Web Development
Django Core | A Reference Guide to Core Django Concepts,True,195,16282,303,159,Intermediate Level,18.5,2016-10-29,Web Development
"Angular 2 Complete E-Commerce App Course - Java,Spring,MySQL",True,195,949,129,89,All Levels,20.5,2017-03-27,Web Development
"Build An Online Bank With Java, Angular 2, Spring and More",True,195,1995,286,45,Beginner Level,6.5,2016-11-01,Web Development
The Complete jQuery Course: From Beginner To Advanced!,True,195,6636,302,50,All Levels,6.0,2016-05-26,Web Development
Projects in AngularJS - Learn by building 10 Projects,True,40,7146,629,77,All Levels,14.5,2015-06-25,Web Development
The Ultimate Vue JS 2 Developers Course,True,195,1703,292,178,All Levels,13.0,2016-12-16,Web Development
React JS - Build real world JS apps & deploy on cloud,True,175,12815,262,53,All Levels,8.5,2017-02-12,Web Development
Angular 4 Front To Back,True,40,44,0,68,All Levels,8.5,2017-07-06,Web Development
"Modern Web Development with SASS, Gulp, NPM & Web Workflows",True,95,502,62,59,Beginner Level,5.0,2016-12-31,Web Development
"HTML5, CSS3 And JavaScript Fundamentals 2016",True,115,627,125,7,All Levels,1.0,2016-09-01,Web Development
"Angular 4 - Concepts, Code and Collective Wisdom",True,50,851,164,75,Intermediate Level,4.5,2016-04-20,Web Development
Learn E-Commerce Website in PHP & MySQL From Scratch!,False,0,29990,1342,87,All Levels,17.5,2014-08-10,Web Development
JavaScript Game Development: Create Your Own Breakout Game,False,0,10179,314,21,All Levels,1.5,2016-09-26,Web Development
HTML and HTML5 For Beginners 2016,True,200,563,178,32,All Levels,3.0,2016-08-11,Web Development
A Very Complete Introduction To Laravel,True,20,2320,114,43,All Levels,6.0,2014-08-24,Web Development
"Learn to code, Become a Web Developer and Master JavaScript!",True,200,2353,47,91,All Levels,10.0,2015-01-22,Web Development
Serverless Architecture on Amazon Web Services,False,0,13210,978,8,Intermediate Level,0.55,2016-11-30,Web Development
jQuery Essentials: Learn the Fundamental of jQuery,True,20,1004,43,40,All Levels,3.5,2016-08-19,Web Development
Expert Guide : Mastering Functions in JavaScript !,True,195,3015,30,19,All Levels,2.5,2015-06-19,Web Development
Learn Angular 4 from Scratch,False,0,8693,522,11,Beginner Level,1.5,2017-05-02,Web Development
Discover HTML Essential guide to HTML how to create webpages,True,85,8711,44,22,Beginner Level,1.5,2015-10-17,Web Development
HTML5 and CSS3 for beginners: Create a Website from Scratch,True,200,9945,101,43,Beginner Level,2.0,2017-02-17,Web Development
Introduction to Web Development,True,20,18143,159,15,Beginner Level,2.0,2013-10-04,Web Development
jQuery Fundamentals Powerful Bootcamp for beginners,True,150,13882,63,47,All Levels,3.0,2015-08-04,Web Development
The Complete HTML & CSS Course - From Novice To Professional,True,195,57422,874,84,All Levels,7.5,2015-07-27,Web Development
JavaScript Basics Web Development Building Blocks,True,95,10179,68,17,Beginner Level,1.5,2015-08-14,Web Development
Bootstrap unleash the power faster & easier web development,True,150,18101,88,68,All Levels,5.5,2015-08-14,Web Development
JavaScript Design Patterns: 20 Patterns for Expert Code,True,95,2789,243,26,Expert Level,3.5,2015-11-12,Web Development
Fix Google's New 'Not Secure' Warning with Let's Encrypt!,True,95,1437,24,20,Beginner Level,1.0,2017-03-09,Web Development
JavaScript for Beginners Welcome to learning JavaScript,True,50,10864,63,26,Beginner Level,2.0,2016-02-01,Web Development
Benefits of Thinking Mobile First Future of Website Design,True,75,14254,27,20,Beginner Level,1.5,2015-05-13,Web Development
Javascript from Beginner to Advanced Level,True,195,6134,160,50,Beginner Level,6.5,2016-12-19,Web Development
AJAX Development,True,20,7867,147,23,All Levels,3.0,2012-05-15,Web Development
Interaction Design Specialist For Web Developers,True,95,8594,37,18,All Levels,2.0,2016-07-04,Web Development
PHP Security,True,50,1892,147,24,All Levels,2.5,2016-06-15,Web Development
The Bubble Course - Create Complete Web Apps without Coding,True,30,3960,220,47,Beginner Level,4.5,2016-07-24,Web Development
The Complete HTML5 & CSS3 Course Build Professional Websites,True,195,10518,129,57,All Levels,4.5,2015-08-11,Web Development
CSS Web Development Crash Course,True,20,10008,53,26,Beginner Level,2.5,2016-12-01,Web Development
Mastering DevOps,True,100,1023,118,38,Intermediate Level,6.0,2016-10-21,Web Development
Building Websites Create a fully functional Web contact form,True,200,3392,29,19,Beginner Level,1.5,2016-10-06,Web Development
Create a Dynamic User Registration Form from scratch,True,100,7213,50,38,Beginner Level,3.0,2016-01-09,Web Development
A 13 Hour SQL Server 2014 /ASP.NET/CSS/C#/jQuery Course,True,35,4183,231,86,Intermediate Level,14.0,2014-10-12,Web Development
HTML Workshop,True,20,25854,306,17,All Levels,2.0,2012-04-08,Web Development
Python for Beginners: Python Programming Language | Tutorial,True,150,6153,125,84,Beginner Level,5.0,2015-06-14,Web Development
Creating Animations using HTML5 Canvas,True,25,4010,17,12,All Levels,1.0,2016-06-13,Web Development
Bootstrap 4: Exploring New Features,True,75,5022,38,13,All Levels,1.0,2016-05-27,Web Development
Bootstrap 3 -> Profitable WordPress Theme Development!,True,40,5547,80,40,All Levels,3.5,2014-10-22,Web Development
Intro to Git,True,20,2532,291,30,Beginner Level,1.0,2016-06-28,Web Development
WordPress Domination #2: Leads & Scarcity,True,95,2362,4,13,Beginner Level,1.0,2017-01-10,Web Development
Learn How to Manage & Customize  Web Sites By Drupal CMS,True,140,7741,9,36,All Levels,2.5,2016-12-11,Web Development
Using Modern JavaScript Today,True,50,1658,185,68,Intermediate Level,16.5,2016-01-01,Web Development
Up and Running with jQuery,False,0,3324,138,19,All Levels,5.0,2017-02-03,Web Development
Learn How To Build A Professional Web Site By Using Joomla,True,70,7184,22,29,All Levels,4.0,2016-08-11,Web Development
Power up HTML5 with JavaScript,True,100,4442,23,28,Beginner Level,2.0,2016-03-15,Web Development
Node Package Manager Course: Build and Publish NPM Modules,True,30,7196,8,38,All Levels,6.5,2017-06-06,Web Development
WordPress Look and Feel with Themes,True,25,2371,10,12,Beginner Level,1.0,2016-09-04,Web Development
PHP with Laravel for beginners - Become a Master in Laravel,True,150,8496,1838,308,All Levels,29.5,2016-04-21,Web Development
JavaScript 2017: Become Top Rated Web Developer,True,115,1346,330,32,All Levels,3.0,2017-05-03,Web Development
The Complete Web Developer Bootcamp - Beginner to Expert,True,190,14103,1548,197,All Levels,21.5,2015-01-19,Web Development
Full-Stack Web Apps with Meteor and React,True,85,3295,531,162,All Levels,31.5,2016-11-23,Web Development
Angular 4: From Theory to Practice & FREE E-Book,True,200,4375,622,129,Intermediate Level,15.5,2016-11-15,Web Development
The Complete Sass & SCSS Course: From Beginner to Advanced,True,195,12021,660,41,All Levels,4.0,2016-02-24,Web Development
Become a Certified Web Developer,True,100,26673,1090,185,All Levels,12.0,2011-12-20,Web Development
Become a Web Developer from Scratch,True,120,69186,2408,197,All Levels,27.5,2011-11-19,Web Development
Ultimate Angular 4 (previously Angular 2) with Bootstrap 4,True,50,11384,1846,80,All Levels,5.5,2016-09-19,Web Development
The Ultimate Beginner's Guide to Django,True,200,2390,497,82,Beginner Level,9.0,2016-12-11,Web Development
React JS - Mastering Redux,True,100,7059,116,58,All Levels,5.0,2017-06-19,Web Development
Professional Ruby on Rails Developer with Rails 5,True,200,3179,214,174,All Levels,20.5,2017-02-19,Web Development
"Ruby on Rails 5 - BDD, RSpec and Capybara",True,200,1870,193,145,All Levels,14.5,2016-10-28,Web Development
Back to School Web Development and Programming Bundle,True,200,18170,117,779,Beginner Level,44.5,2013-08-19,Web Development
Complete ASP NET MVC Web Development - Newbie to Ninja!,True,195,6073,627,66,All Levels,9.0,2014-11-24,Web Development
The Complete DevOps Engineer Course 2.0 - Java & Kubernetes,True,195,5335,105,117,All Levels,14.0,2016-08-06,Web Development
All about NodeJS,True,50,8755,931,133,All Levels,15.5,2014-12-19,Web Development
How To Create A Wordpress Website 2016 | NEW Divi Theme 3.0!,True,40,4144,383,43,Beginner Level,5.5,2016-10-13,Web Development
The Complete jQuery Course - From Beginner to Professional!,True,200,6420,134,188,All Levels,22.5,2016-06-20,Web Development
Build a complete Fiverr clone with Node + Algolia + Paypal,True,30,1741,26,87,All Levels,9.0,2017-05-20,Web Development
The Ultimate Web Development Course,True,50,9881,329,136,All Levels,12.0,2013-08-25,Web Development
React From The Ground Up,True,150,3252,401,62,All Levels,12.5,2016-05-02,Web Development
Javascript for Beginners Learn by Doing Practical Exercises,True,100,5089,685,29,All Levels,3.5,2015-01-31,Web Development
8 Beautiful Ruby on Rails Apps in 30 Days & TDD - Immersive ,True,100,5962,466,132,All Levels,16.0,2016-03-08,Web Development
Wordpress Website Mastery 2017,False,0,5181,64,22,Beginner Level,2.5,2017-01-18,Web Development
How To Make an eCommerce Website With Wordpress 2017,False,0,3493,43,26,Beginner Level,4.5,2017-05-09,Web Development
Mastering ASP.NET MVC 5 From Scratch Using C#,True,50,417,65,109,All Levels,13.0,2016-12-01,Web Development
Start Web Development with GIS Map in JavaScript,True,60,1599,26,49,All Levels,3.0,2016-02-28,Web Development
Learn to Build Websites using Twitter Bootstrap,False,0,15134,523,12,All Levels,2.5,2014-04-14,Web Development
Web Development Tools the Pros Use: Code Productivity Hacks,True,30,2596,11,39,Beginner Level,4.0,2015-10-08,Web Development
WordPress : An Overview,True,45,1783,16,15,Beginner Level,0.6,2015-02-02,Web Development
Create Startup Landing Page with Viral Marketing Strategies,False,0,12974,120,13,Beginner Level,1.0,2015-01-03,Web Development
JavaScript : JavaScript Awesomeness,True,25,785,20,25,Beginner Level,1.0,2016-09-15,Web Development
Mastering CSS 3.0 Selectors,False,0,4115,63,13,Intermediate Level,2.0,2017-02-22,Web Development
WordPress Backup And Restore Fundamentals,False,0,13242,131,24,Intermediate Level,1.0,2014-06-24,Web Development
Learn HTML and CSS to make a Website,True,20,1154,12,71,Beginner Level,6.0,2016-01-28,Web Development
1 Hour HTML,True,200,16212,514,20,Beginner Level,1.0,2013-07-09,Web Development
Angular 2 Crash Course with TypeScript,True,100,16409,589,74,All Levels,4.0,2016-06-14,Web Development
Boost your website speed without any coding!,True,50,1337,28,12,All Levels,1.0,2017-05-14,Web Development
Professional Rails Code Along,True,40,1469,237,120,Intermediate Level,19.0,2016-08-04,Web Development
ASP.NET Web API 2 Hands-On,True,20,2660,276,16,All Levels,1.5,2016-06-19,Web Development
Create a MEAN App by Example - Full Stack Course,True,50,421,26,33,Intermediate Level,3.5,2017-05-08,Web Development
The Original Complete Web Developer Course.,True,20,31070,742,195,Beginner Level,18.0,2012-10-28,Web Development
Angular 2 From The Ground Up,True,30,1737,471,87,All Levels,11.5,2016-06-02,Web Development
Complete Web Development Course + Building 5 Websites!,True,200,11492,174,118,All Levels,24.5,2016-03-21,Web Development
WP Plugin Development - Build your own plugin!,True,200,5439,22,24,Beginner Level,4.0,2017-06-13,Web Development
Sass: From Beginner to Advanced,True,40,8059,231,39,All Levels,2.0,2016-07-21,Web Development
Build Flat Responsive Website from Scratch - Complete Course,True,35,12105,144,54,All Levels,7.5,2013-12-04,Web Development
Wordpress for Beginners - Build a Live Website from Scratch,True,20,3877,92,15,Beginner Level,1.5,2015-09-09,Web Development
"Essential JavaScript, jQuery and AngularJS Training",True,30,2919,136,70,Intermediate Level,7.0,2015-07-09,Web Development
The Pro Ruby on Rails Starter,True,45,2409,90,19,Beginner Level,2.5,2015-03-04,Web Development
Unit Testing AngularJS: Build Bugfree Apps That Always Work!,True,25,2083,213,23,All Levels,2.5,2016-01-24,Web Development
WordPress Blog : Create a WordPress Website for Beginners,True,20,2076,8,20,Beginner Level,2.0,2017-02-26,Web Development
Introduction to HTML5 Canvas basics of drawing,True,200,2918,16,17,Beginner Level,1.0,2016-03-14,Web Development
"Thoughtful Web Development Course: HTML, Vue.js, PHP, MySQL",True,200,842,144,536,All Levels,25.0,2016-10-11,Web Development
Kids Coding - Beginners CSS,True,100,7130,30,17,All Levels,1.0,2013-07-25,Web Development
PHP & MySQL - Learn The Easy Way. Master PHP & MySQL Quickly,True,50,5549,92,143,All Levels,15.5,2012-12-15,Web Development
Learning Path: Magento: Master and Test Magento 2 with Ease,True,200,155,9,37,Expert Level,6.0,2017-05-26,Web Development
The Complete hapiJS Course - Go From Beginner To Advanced!,True,195,1697,64,54,All Levels,6.0,2016-07-13,Web Development
Ruby On Rails For Web Development,True,195,2526,185,24,Beginner Level,5.0,2014-12-17,Web Development
Create eye-catching WordPress website from scratch,True,30,2342,15,19,Beginner Level,4.5,2016-12-28,Web Development
Become A Web Developer And Seller - Build Websites With HTML,True,200,21730,61,35,Beginner Level,2.5,2013-10-05,Web Development
WordPress Tips and Tricks,True,200,1117,10,37,Intermediate Level,2.5,2017-06-08,Web Development
HTML Tutorials : HTML Code for Website Creating,True,20,2401,15,27,All Levels,3.0,2017-02-22,Web Development
Complete HTML5 and CSS3 Course +1 Start to Finish Project,True,200,3887,81,94,All Levels,8.5,2015-09-07,Web Development
Web Development With HTML CSS BOOTSTRAP JQUERY for Beginners,True,35,1156,4,59,Beginner Level,5.0,2017-05-30,Web Development
HTML5 Specialist: Comprehensive HTML5 Training,True,100,1385,188,83,All Levels,5.0,2016-06-22,Web Development
CSS and CSS3 For Absolute Beginners,True,75,10890,212,33,Beginner Level,5.0,2013-11-01,Web Development
Build a Complete JQuery Plugin (Image Pop-up Dialog),True,20,1126,10,12,All Levels,1.0,2017-02-23,Web Development
How to create HTML Forms,True,30,3652,60,7,Beginner Level,0.6666666666666666,2016-04-29,Web Development
ReactJS and Flux: Learn By Building 10 Projects,True,60,1723,258,60,All Levels,11.0,2016-02-18,Web Development
How To Make A Business Website In 1 Day With Wix FAST & EASY,True,20,3759,24,25,Beginner Level,4.0,2016-04-18,Web Development
PHP Date and Time Course by Edwin Diaz,True,40,1653,53,14,All Levels,1.5,2016-05-03,Web Development
Start Your Own Forum Website in 15 Minutes ,True,40,5387,38,15,All Levels,1.0,2015-01-26,Web Development
Hit the ground running with AngularJS with Dion Yang,True,100,4563,49,13,All Levels,1.5,2015-11-26,Web Development
Learn CSS Transition and Animation ,True,100,3757,28,20,All Levels,1.0,2015-05-27,Web Development
Learn JavaScript from scratch,True,20,4193,92,44,Beginner Level,2.5,2015-07-30,Web Development
WordPress for Beginners - Tutorial - From Novice to Know-How,True,20,3694,48,39,Beginner Level,4.0,2015-08-28,Web Development
RESTful API with Laravel,True,45,1905,228,57,All Levels,6.0,2015-02-05,Web Development
Learn Ruby on Rails for Absolute Beginners,True,195,2875,20,36,All Levels,4.5,2015-10-14,Web Development
